<?xml version="1.0" encoding="UTF-8"?>

<!DOCTYPE Threats SYSTEM "ThreatDTD.dtd"   >
<Threats>
<Threat name="Bomb" affectsAssetType="Host" causesEvent="HostDeath" defaultEventLikelihoodProb="NONE" probIntervalInMins="1000" >

    <VulnerableAssets>
        <AssetFilter>
            <Term propName="location" propValue="HiWay" op="EQ" />
        </AssetFilter>
        <EventLikelihoodInterval>
            <ClockInterval intervalStart="1800" durationHrs="12" probability="VERY_LOW" probIntervalInMins="1000" />
        </EventLikelihoodInterval>
    </VulnerableAssets>

    <VulnerableAssets>
        <AssetFilter>
            <Term propName="location" propValue="OffRoad" op="EQ" />
        </AssetFilter>
        <EventLikelihoodInterval>
            <ClockInterval intervalStart="1800" durationHrs="12" probability="MEDIUM" probIntervalInMins="1000" />
            <ClockInterval intervalStart="0600" durationHrs="12" probability="LOW" probIntervalInMins="1000" />
        </EventLikelihoodInterval>
    </VulnerableAssets>

    <VulnerableAssets>
	  <AssetFilter>
           <CorruptHostExistsOnNetwork value="TRUE" />    
	  </AssetFilter>
        <EventLikelihood probability="LOW" probIntervalInMins="1000" />
    </VulnerableAssets>

    <VulnerableAssets>
	  <AssetFilter>
           <CorruptHostExists value="TRUE" />    
	  </AssetFilter>
        <EventLikelihood probability="HIGH" probIntervalInMins="1000" />
    </VulnerableAssets>

</Threat>

<Threat name="AgentVirus" affectsAssetType="Agent" causesEvent="AgentDeath" defaultEventLikelihoodProb="MEDIUM" probIntervalInMins="100" />

<Threat name="NodeVirus" affectsAssetType="Node" causesEvent="NodeDeath" defaultEventLikelihoodProb="VERY_LOW" probIntervalInMins="1000" />


</Threats>